{
  "schema_version": "1.0.0",
  "review_case_id": "review-case-run-20260510T132228Z-0e355482",
  "metadata": {
    "run_id": "run-20260510T132228Z-0e355482",
    "target_id": "implementation:phase-field-cpp",
    "target_artifact_hash": "sha256:61f9e79458f72ab4b1deb576870c73819b8dba5ece86aa7407be57a98ce90b0d",
    "source_repository_id": "kenoogl/Rwiki-dev",
    "source_revision": "0793808d9f15b7cd2cba5bea2461b973b45f20ed",
    "phase_profile": "tasks",
    "treatment": "single",
    "review_mode": "runtime_mediated",
    "protocol_version": "1.0.0",
    "runtime_version": "0.1.0",
    "schema_set_version": "1.0.0",
    "prompt_set_version": "1.0.0",
    "run_status": "closed",
    "validator_status": "passed",
    "human_signoff_status": "approved",
    "evidence_class": "valid",
    "started_at": "2026-05-10T13:22:28Z",
    "closed_at": "2026-05-10T13:22:28Z"
  },
  "step_records": [
    {
      "step_id": "step-01",
      "step_name": "primary_detection",
      "step_status": "completed",
      "step_prompt_artifact_id": "foundation.primary_reviewer.default",
      "step_started_at": null,
      "step_closed_at": null
    },
    {
      "step_id": "step-02",
      "step_name": "adversarial_review",
      "step_status": "skipped",
      "step_prompt_artifact_id": "foundation.adversarial_reviewer.default",
      "step_started_at": null,
      "step_closed_at": null
    },
    {
      "step_id": "step-03",
      "step_name": "judgment",
      "step_status": "completed",
      "step_prompt_artifact_id": "foundation.judgment_reviewer.default",
      "step_started_at": null,
      "step_closed_at": null
    },
    {
      "step_id": "step-04",
      "step_name": "integration",
      "step_status": "completed",
      "step_prompt_artifact_id": "foundation.integration.default",
      "step_started_at": null,
      "step_closed_at": null
    }
  ],
  "findings": [
    {
      "schema_version": "1.0.0",
      "finding_id": "step-01-finding-boundary",
      "run_id": "run-20260510T132228Z-0e355482",
      "step_id": "step-01",
      "source_role": "primary_reviewer",
      "severity": "high",
      "summary": "Boundary-condition semantics are review-critical because the upstream spec and snapshot explicitly require periodic-edge consistency across simulation and rendering. Evidence excerpt: numerical update, boundary handling, visualization, I/O, error handling を含む implementation package である。",
      "source_refs": [
        ".kiro/methodology/dual-reviewer-spec-driven-paper/phase-field-implementation-phase-first-snapshot.md",
        ".kiro/specs/phase-field-reverse-spec/requirements.md"
      ],
      "counter_evidence_refs": [

      ],
      "judgment_ref": "steps/step_c_judgment.json#judgment-step-01-finding-boundary",
      "decision_unit_id": "decision-unit-step-01-finding-boundary",
      "human_decision_ref": "decisions/decision_units.json#decision-unit-step-01-finding-boundary",
      "impact_score_ref": null,
      "failure_observation_refs": [
        "implementation:boundary_condition_semantics"
      ],
      "validation_refs": {
        "invalidation_marker_refs": [

        ]
      }
    },
    {
      "schema_version": "1.0.0",
      "finding_id": "step-01-finding-update-order",
      "run_id": "run-20260510T132228Z-0e355482",
      "step_id": "step-01",
      "source_role": "primary_reviewer",
      "severity": "medium",
      "summary": "Update ordering and state mutation risk should be inspected because the time-step sequence is explicitly fixed, so sequencing drift can change phase-field evolution. Evidence excerpt: algorithmic correctness, boundary semantics, parameter interpretation, update ordering, numerical caveat, implementation brittleness が同時に存在する。",
      "source_refs": [
        ".kiro/methodology/dual-reviewer-spec-driven-paper/phase-field-implementation-phase-first-snapshot.md",
        ".kiro/specs/phase-field-reverse-spec/requirements.md",
        ".kiro/specs/phase-field-reverse-spec/design.md",
        ".kiro/specs/phase-field-reverse-spec/tasks.md"
      ],
      "counter_evidence_refs": [

      ],
      "judgment_ref": "steps/step_c_judgment.json#judgment-step-01-finding-update-order",
      "decision_unit_id": "decision-unit-step-01-finding-update-order",
      "human_decision_ref": "decisions/decision_units.json#decision-unit-step-01-finding-update-order",
      "impact_score_ref": null,
      "failure_observation_refs": [
        "implementation:update_ordering_state_mutation"
      ],
      "validation_refs": {
        "invalidation_marker_refs": [

        ]
      }
    }
  ],
  "validation_artifacts": {
    "validator_result_refs": [
      "validation/validator_result.json#validator-result-da7fdde6"
    ],
    "invalidation_marker_refs": [

    ]
  }
}