{
  "schema_version": "1.0.0",
  "review_case_id": "review-case-run-20260510T215435Z-e2e6039f",
  "metadata": {
    "run_id": "run-20260510T215435Z-e2e6039f",
    "target_id": "spec:F1-design-phase-field-reverse-spec",
    "target_artifact_hash": "sha256:04eb0ed5ac1c1ea0e536030dd8f6eaa0eec6a90d39aeb04f4784da9f279e2a38",
    "source_repository_id": "kenoogl/Rwiki-dev",
    "source_revision": "0793808d9f15b7cd2cba5bea2461b973b45f20ed",
    "phase_profile": "design",
    "treatment": "dual+judgment",
    "review_mode": "runtime_mediated",
    "protocol_version": "1.0.0",
    "runtime_version": "0.1.0",
    "schema_set_version": "1.0.0",
    "prompt_set_version": "1.0.0",
    "run_status": "closed",
    "validator_status": "passed",
    "human_signoff_status": "approved",
    "evidence_class": "valid",
    "started_at": "2026-05-10T21:54:35Z",
    "closed_at": "2026-05-10T21:54:35Z"
  },
  "step_records": [
    {
      "step_id": "step-01",
      "step_name": "primary_detection",
      "step_status": "completed",
      "step_prompt_artifact_id": "foundation.primary_reviewer.default",
      "step_started_at": null,
      "step_closed_at": null
    },
    {
      "step_id": "step-02",
      "step_name": "adversarial_review",
      "step_status": "completed",
      "step_prompt_artifact_id": "foundation.adversarial_reviewer.default",
      "step_started_at": null,
      "step_closed_at": null
    },
    {
      "step_id": "step-03",
      "step_name": "judgment",
      "step_status": "completed",
      "step_prompt_artifact_id": "foundation.judgment_reviewer.default",
      "step_started_at": null,
      "step_closed_at": null
    },
    {
      "step_id": "step-04",
      "step_name": "integration",
      "step_status": "completed",
      "step_prompt_artifact_id": "foundation.integration.default",
      "step_started_at": null,
      "step_closed_at": null
    }
  ],
  "findings": [
    {
      "schema_version": "1.0.0",
      "finding_id": "step-01-finding-boundary-density",
      "run_id": "run-20260510T215435Z-e2e6039f",
      "step_id": "step-01",
      "source_role": "primary_reviewer",
      "severity": "high",
      "summary": "The design creates many tightly coupled boundaries, so ownership and integration seams must remain explicit downstream. Evidence excerpt: - V4 review Round 1-5 適用に耐える明確な component boundary (= 単一責務 / 依存方向単一化)",
      "source_refs": [
        ".kiro/specs/phase-field-reverse-spec/design.md",
        ".kiro/specs/phase-field-reverse-spec/requirements.md",
        ".kiro/specs/phase-field-reverse-spec/tasks.md",
        ".kiro/methodology/dual-reviewer-spec-driven-paper/spec-track-first-case-phase-field-reverse-spec.md"
      ],
      "counter_evidence_refs": [

      ],
      "judgment_ref": "steps/step_c_judgment.json#judgment-step-01-finding-boundary-density",
      "decision_unit_id": "decision-unit-step-01-finding-boundary-density",
      "human_decision_ref": "decisions/decision_units.json#decision-unit-step-01-finding-boundary-density",
      "impact_score_ref": null,
      "failure_observation_refs": [
        "spec:design_boundary_density"
      ],
      "validation_refs": {
        "invalidation_marker_refs": [

        ]
      }
    },
    {
      "schema_version": "1.0.0",
      "finding_id": "step-01-finding-failure-contract",
      "run_id": "run-20260510T215435Z-e2e6039f",
      "step_id": "step-01",
      "source_role": "primary_reviewer",
      "severity": "medium",
      "summary": "Failure contracts fixed in design should be preserved downstream rather than reinterpreted as local implementation detail. Evidence excerpt: - 全 component 実装 = Numerical Engine / Initial Field Builder / Concentration Clamp / Mean Composition Corrector / Snapshot Writer / Snapshot Reader / Renderer / BMP Writer / Re-render Function / Simulation Module",
      "source_refs": [
        ".kiro/specs/phase-field-reverse-spec/design.md",
        ".kiro/specs/phase-field-reverse-spec/requirements.md",
        ".kiro/specs/phase-field-reverse-spec/tasks.md"
      ],
      "counter_evidence_refs": [

      ],
      "judgment_ref": "steps/step_c_judgment.json#judgment-step-01-finding-failure-contract",
      "decision_unit_id": "decision-unit-step-01-finding-failure-contract",
      "human_decision_ref": "decisions/decision_units.json#decision-unit-step-01-finding-failure-contract",
      "impact_score_ref": null,
      "failure_observation_refs": [
        "spec:design_failure_contract"
      ],
      "validation_refs": {
        "invalidation_marker_refs": [

        ]
      }
    },
    {
      "schema_version": "1.0.0",
      "finding_id": "step-02-finding-validation-ownership",
      "run_id": "run-20260510T215435Z-e2e6039f",
      "step_id": "step-02",
      "source_role": "adversarial_reviewer",
      "severity": "medium",
      "summary": "Validation ownership remains adversarially review-worthy because downstream tasks can leave cross-file expectations implicit. Evidence excerpt: # Design Document",
      "source_refs": [
        ".kiro/specs/phase-field-reverse-spec/design.md",
        ".kiro/specs/phase-field-reverse-spec/requirements.md",
        ".kiro/specs/phase-field-reverse-spec/tasks.md",
        ".kiro/methodology/dual-reviewer-spec-driven-paper/spec-track-first-case-phase-field-reverse-spec.md",
        "dual-reviewer-rebuild/docs/alignment/cross-spec-design-alignment.md"
      ],
      "counter_evidence_refs": [
        ".kiro/specs/phase-field-reverse-spec/design.md",
        ".kiro/specs/phase-field-reverse-spec/requirements.md",
        ".kiro/specs/phase-field-reverse-spec/tasks.md",
        ".kiro/methodology/dual-reviewer-spec-driven-paper/spec-track-first-case-phase-field-reverse-spec.md",
        "dual-reviewer-rebuild/docs/alignment/cross-spec-design-alignment.md"
      ],
      "judgment_ref": "steps/step_c_judgment.json#judgment-step-02-finding-validation-ownership",
      "decision_unit_id": "decision-unit-step-02-finding-validation-ownership",
      "human_decision_ref": "decisions/decision_units.json#decision-unit-step-02-finding-validation-ownership",
      "impact_score_ref": null,
      "failure_observation_refs": [
        "spec:design_validation_ownership"
      ],
      "validation_refs": {
        "invalidation_marker_refs": [

        ]
      }
    }
  ],
  "validation_artifacts": {
    "validator_result_refs": [
      "validation/validator_result.json#validator-result-f314fe63"
    ],
    "invalidation_marker_refs": [

    ]
  }
}