{
  "schema_version": "1.0.0",
  "review_case_id": "review-case-run-fixture-001",
  "metadata": {
    "run_id": "run-fixture-001",
    "target_id": "spec:dual-reviewer-runtime:tasks",
    "target_artifact_hash": "sha256:fixture-target-hash",
    "source_repository_id": "kenoogl/Rwiki-dev",
    "source_revision": "0943943",
    "phase_profile": "tasks",
    "treatment": "dual+judgment",
    "review_mode": "runtime_mediated",
    "protocol_version": "1.0.0",
    "runtime_version": "0.1.0",
    "schema_set_version": "1.0.0",
    "prompt_set_version": "1.0.0",
    "run_status": "closed",
    "validator_status": "passed",
    "human_signoff_status": "approved",
    "evidence_class": "valid",
    "started_at": "2026-05-08T08:00:00Z",
    "closed_at": "2026-05-08T08:10:00Z"
  },
  "step_records": [
    {
      "step_id": "step-01",
      "step_name": "primary_detection",
      "step_status": "completed",
      "step_prompt_artifact_id": "runtime.primary_reviewer.primary_detection.deferred",
      "step_started_at": null,
      "step_closed_at": null
    },
    {
      "step_id": "step-02",
      "step_name": "adversarial_review",
      "step_status": "completed",
      "step_prompt_artifact_id": "runtime.adversarial_reviewer.adversarial_review.deferred",
      "step_started_at": null,
      "step_closed_at": null
    },
    {
      "step_id": "step-03",
      "step_name": "judgment",
      "step_status": "completed",
      "step_prompt_artifact_id": "runtime.judgment.reviewer",
      "step_started_at": null,
      "step_closed_at": null
    },
    {
      "step_id": "step-04",
      "step_name": "integration",
      "step_status": "completed",
      "step_prompt_artifact_id": "runtime.integration.integration.deferred",
      "step_started_at": null,
      "step_closed_at": null
    }
  ],
  "findings": [
    {
      "schema_version": "1.0.0",
      "finding_id": "finding-fixture-001",
      "run_id": "run-fixture-001",
      "step_id": "step-01",
      "source_role": "primary_reviewer",
      "severity": "medium",
      "summary": "Fixture finding for evaluation metrics.",
      "source_refs": [
        "steps/step_a_primary_detection.json#finding-fixture-001"
      ],
      "counter_evidence_refs": [],
      "judgment_ref": "steps/step_c_judgment.json#judgment-fixture-001",
      "decision_unit_id": "decision-unit-fixture-001",
      "human_decision_ref": "decisions/decision_units.json#decision-unit-fixture-001",
      "impact_score_ref": null,
      "failure_observation_refs": [],
      "validation_refs": {
        "invalidation_marker_refs": []
      }
    }
  ],
  "validation_artifacts": {
    "validator_result_refs": [
      "validation/validator_result.json#validator-result-fixture-001"
    ],
    "invalidation_marker_refs": []
  }
}
